{
  "_schema_version": 1,
  "version": "1.0.0",
  "last_changed": "2026-05-25",
  "enforcement": {
    "default": "pre_authorize",
    "fallback": "deny",
    "audit_required": [
      "CREATE",
      "UPDATE",
      "DELETE"
    ]
  },
  "data_scope": {
    "default_field": "tenant_id",
    "override_allowed": [
      "ADMIN"
    ],
    "types": [
      {
        "id": "EMPRESA_COMPLETA",
        "value_kind": "none",
        "description": "Sem restrição dentro da empresa — vê todos os registros."
      }
    ]
  },
  "roles": [
    {
      "code": "CUIDADORA_FAMILIAR",
      "name": "Cuidadora Familiar",
      "description": "Jamilly Amaral, cuidadora familiar de Márcio Amaral (paciente com doença neurodegenerativa em estágio avançado), monitorando em ambiente domiciliar. (Danilo Amaral conduz o projeto como engenheiro/BA — não é o cuidador do dia a dia.)",
      "category": "default",
      "active": true,
      "data_scope_tipo": null,
      "permission_bundle": {
        "kind": "all",
        "note": "TODO: refine permissions — defaulted to `all` because per-role authority is not declared in discovery. Edit before going to production."
      }
    }
  ],
  "$comment": "Workspace ships with minimal defaults (D-103, Gap B). See templates/architecture/decisions/_examples/eerripe-rbac.partial.json for the BOSQ-ERP starting set; copy to <project>/arch/overrides/rbac.partial.json and the D-074 deep-merge will apply it during P2."
}
